{
  "$schema": "https://json-schema.org/draft/2020-12/schema",
  "$id": "urn:steelmatter:proposed:mandate:1",
  "title": "mandate proposed unsigned payload",
  "type": "object",
  "properties": {
    "schema_version": {
      "const": "1"
    },
    "crypto_profile": {
      "const": "SM-JWS-ES256-1"
    },
    "mandate_id": {
      "type": "string",
      "minLength": 1,
      "maxLength": 128,
      "pattern": "^[A-Za-z0-9][A-Za-z0-9._:-]*$"
    },
    "tenant_id": {
      "type": "string",
      "minLength": 1,
      "maxLength": 128,
      "pattern": "^[A-Za-z0-9][A-Za-z0-9._:-]*$"
    },
    "issuer_id": {
      "type": "string",
      "minLength": 1,
      "maxLength": 128,
      "pattern": "^[A-Za-z0-9][A-Za-z0-9._:-]*$"
    },
    "revision": {
      "type": "integer",
      "minimum": 1,
      "maximum": 9007199254740991
    },
    "control_epoch": {
      "type": "integer",
      "minimum": 1,
      "maximum": 9007199254740991
    },
    "actor_ids": {
      "type": "array",
      "minItems": 1,
      "maxItems": 100,
      "uniqueItems": true,
      "items": {
        "type": "string",
        "minLength": 1,
        "maxLength": 128,
        "pattern": "^[A-Za-z0-9][A-Za-z0-9._:-]*$"
      }
    },
    "audience": {
      "type": "string",
      "minLength": 1,
      "maxLength": 128,
      "pattern": "^[A-Za-z0-9][A-Za-z0-9._:-]*$"
    },
    "operation": {
      "const": "purchase_order.issue"
    },
    "supplier_ids": {
      "type": "array",
      "minItems": 1,
      "maxItems": 100,
      "uniqueItems": true,
      "items": {
        "type": "string",
        "minLength": 1,
        "maxLength": 128,
        "pattern": "^[A-Za-z0-9][A-Za-z0-9._:-]*$"
      }
    },
    "delivery_ids": {
      "type": "array",
      "minItems": 1,
      "maxItems": 100,
      "uniqueItems": true,
      "items": {
        "type": "string",
        "minLength": 1,
        "maxLength": 128,
        "pattern": "^[A-Za-z0-9][A-Za-z0-9._:-]*$"
      }
    },
    "currency": {
      "const": "INR"
    },
    "limit_minor": {
      "type": "integer",
      "minimum": 1,
      "maximum": 9007199254740991
    },
    "issued_at": {
      "type": "string",
      "format": "date-time",
      "pattern": "^\\d{4}-\\d{2}-\\d{2}T\\d{2}:\\d{2}:\\d{2}Z$"
    },
    "expires_at": {
      "type": "string",
      "format": "date-time",
      "pattern": "^\\d{4}-\\d{2}-\\d{2}T\\d{2}:\\d{2}:\\d{2}Z$"
    }
  },
  "required": [
    "schema_version",
    "crypto_profile",
    "mandate_id",
    "tenant_id",
    "issuer_id",
    "revision",
    "control_epoch",
    "actor_ids",
    "audience",
    "operation",
    "supplier_ids",
    "delivery_ids",
    "currency",
    "limit_minor",
    "issued_at",
    "expires_at"
  ],
  "additionalProperties": false
}
